{"schema_version":"unirouter.source-evidence.component-verification-receipt.v1","product":"unirouter","campaign_id":"source-evidence-conformance-20300101","status":"accepted","campaign_manifest_sha256":"sha256:dbb526eb32c89b1f4771b6be265c28235ead650a1ab51557c48250cb04520a5c","component_contract":{"id":"unirouter.source-evidence.component-package.v1","sha256":"sha256:99cfa123a93ec7464cfd0228143d59bf579621095cdf69337109e0d5d4ed803e"},"installed_release":{"schema_version":"unirouter.release-state-identity.v1","sha256":"sha256:0b28c140c3a2835480896cf4d64e726300ef67d4a7cf779138e2fca032d23f35"},"component_scope_receipt":{"schema_version":"unirouter.source-evidence-scope-receipt.v1","sha256":"sha256:e4b338ad0d353bdab27bbfdc405a9c25ba099ce9b67cf77ad53305b716d7d407"},"verifier_release":{"id":"unirouter.source-evidence.component-verifier.v1","sha256":"sha256:e025f6856da514a954cdd8b75f761ce5eb4fc1abe898578c051aa32714966df8"},"request_set_sha256":"sha256:72eb7c2d4816be53d4f43c22696fe68becaaceb568524d333b403f4655d7940f","source_binding_sha256":"sha256:c8959a370ae9955df2d732897a9ed24ffff0a2b1d03844dd9ff3dbb8607f9020","source_evidence_signing":{"purpose":"source_evidence","domain":"unirouter.source-evidence.component.v1","signing_key_ref":"source-evidence-conformance-05","signer_public_key_id":"ed25519:sha256:a294e178d8c527e23c15fd2e7d5ff9627d29d0813745eeb35bb13250b704f8d6","trust_set_sha256":"sha256:9a32b63baca57f9eeef2047c74e52c6a759cc3e336d35abadcc09b4cc30f96d8"},"integration_control_pin_sha256":"sha256:51ca89ef23eefc793bb05c03083e8a0f545eb59e54820fb16dffcd91e8fe8e4a","integration_control_release_sha256":"sha256:0604100b8cb8c8a728fc091d1c9269eafbc3cb70449222ab6c10657bca33d3e5","integration_control_binary_sha256":"sha256:ba574ac25abd063914d785a34d097b14a1cf09021a953c40803414900c1f3dc1","checks":["campaign_manifest_n1_verified","component_contract_exact","installed_release_exact","request_set_exact","source_binding_exact","source_evidence_signer_exact","source_scope_receipt_exact","verifier_release_exact"],"verified_at":"2030-01-01T00:01:00Z","effects":{"database_mutation":"none","additional_gateway_calls":0,"provider_calls":0,"feed_calls":0,"upstream_calls":0}}